region,attraction,article
부산,감천 문화마을,칼라플한 감천문화마을 
부산,감천 문화마을,감천문화마을에서 친구들과  여유롭게 다니면서 주말을 보냈다.요즘처럼 우울한 시절에 칼라플한 마을의 독특한 느낌이  마음의 위로가 되었다. 마치 여행중 축제에서 만난 칼라플하고 독특한 느낌같이 비일상적이었다. 여기를 여행할 때는 꼭 좁은 뒷골목으로 다닐것을 추천하고 십다.
부산,감천 문화마을,강추👍
부산,감천 문화마을,해질때쯤가면 아름다운 문화마을을 감상할수있어요 성수기에는 비추... 길이좁아서 사람들이 많으면북적어서 별로에요~ 비수기한적한해질시간에방문해보새요 
부산,감천 문화마을,감천문화마을
부산,감천 문화마을,"코로나로 많은 상점들이 휴점상태입니다.여러가지 색깔의 집들이 아름답게 모여있는곳입니다.연인,친구끼리 방문하기 좋은곳입니다."
부산,감천 문화마을,약간 아쉬운 곳
부산,감천 문화마을,"사람들이 살면서 정말 마을 같으면 좋을텐데, 보여주는 마을이 것 같아 아쉬운 마음이 들더군요. 하기야 살기에는 좀 불편할 것 같긴해요. "
부산,감천 문화마을,마을이 엄청 예뻐요
부산,감천 문화마을,어린왕자 말고도 사진찍으면 이쁜 포토존 엄청 많아요 !! 그리고 예전의 풍경 그대로 간직하고 있기도해요. 다만 마을 안에 음식이나 간식들이 너무 비쌌어요 ㅜㅜ 언덕 엄청 높은 곳에 위치해있지만 버스타면 금방 갈 수 있습니당
부산,감천 문화마을,골목길안 칼라플한 집
부산,감천 문화마을, 마을의 골목길안의 집들은 칼라플한 새단장을 하고 누군가를 기다리고 있다. 골목안 집들은 처음 본 방문자들에게 어서오라고 말을 건넨다.
부산,감천 문화마을,사람없는  이른 아침이 좋지만 상점이용 하실분 10시이후로...
부산,감천 문화마을,오전에 일찍 가세요. 택시타고 가서 감천문화마을 입구에 내리니 9시 2분.  물론 너무 오전이라 상점들이 오픈전이라 썰렁했지만 포토스팟에서는 원없이 수십장씩 사진 찍었어요.  고래사어묵 하나씩 먹고 2번코스로 2시간 걸렸어요. 중간에 잘못빠져서 스팟하나 놓쳤지만 뭐 골목이니까 조용히 빠져나오다보니 합류했어요. 어린왕자는 필수인데 I♡감천 은 유튜브 부산홍보영상 보고서야 있는줄 알았네요.  어린왕자 에코백하나 샀는데 예쁩니당
부산,감천 문화마을,골목이 너무 아기자기 해서 옛 풍경을 그대로 간직한곳
부산,감천 문화마을,골목 골목마다 옛 정취를 그대로 느낄수 있어서 좋았어요. 아이들과 같이 걸으며 좋은 추억 만들고 왔어요.부산 방문하시면 한번쯤 꼭 들러보시길
부산,감천 문화마을,한번쯤은 가볼만한 한곳
부산,감천 문화마을,"그냥 알록달록한 달동네 아닌가 싶었지만 막상가보니 좋네요외국인들을 제일 많이 봤던곳이 아닌가 싶어요.한복체험도 많이 하고있구요, 어릴적 달동네감성을 만끽할수 있어서 좋았어요.군데 군데 포토존이 매우 많습니다.어린왕자와 여우랑 같이 찍으려먼 2~30분은 기다려야할듯.이쁜상점들이 많아서 눈과 입이 즐겁구요, 바다와 함께 볼수있는 전망대에서도 인생사진을 건졌네요.실제 거주하는 주민들이 많으니 오전9시이전이나 오후5시이후에는 가지 않는것이 좋습니다.밀면집에서 밀면을 영어로 when you push라고 적어놓아서 한참 웃었네요. 사장님도 잘못된걸 알면서 그냥 웃으라고 놔뒀데요 ㅋ"
부산,감천 문화마을,아기자기한 뷰를 보기좋은곳 다만
부산,감천 문화마을,아기자기한 상점들과 건물뷰들을 보기좋습니다. 골목골목 돌아다니는 재미가 있습니다.차를 가지고오셨스면 근처 초등학교를 임시주차장으로 쓰고있으니 거기에 세우시고 걸어가시면됩니다. 어린왕자와의 사진은...약 30분의 대기가 필요하니...음 저는 퍂스했습니다. 그외에도 그냥 뷰랑 찍어도 좋을것 같아요
부산,해운대,힐링하기 좋은 바다
부산,해운대,오랜만에 부산에 내려가서 해운대 요트투어를 하며 시간을 보냈어요. 근처에 미포철길도 있고 맛집도 많아서 휴가 가서 힐링하고 오기 좋은 바다였습니다.
부산,해운대,주말 부산여행
부산,해운대,"해운대 백사장에서 열리는 빛 축제가 인상적이었고 산책하기 좋았어요. 주변 맛집도 많고, 편의시설이 많이 있어서 편리했습니다. "
부산,해운대,해운대 바다
부산,해운대,매번 바다 보고 싶을때 ktx타고 방문합니다. 아침에 해운대 바다를 왕복으로 산책하면 운동도 되고 너무 좋아요. 주변에 맛집도 많아서 좋습니다.
부산,해운대,바다가 아름다운 해운대
부산,해운대,"언제 보아도 아름다운 곳입니다.낮보다밤이 아름다운곳입니다주변에 동백섬과 달맞이길,문텐로드와해변열차가 운행하고있습니다.가족,연인,어느누구라도 방문해도 좋습니다."
부산,해운대,여행
부산,해운대,부산에 살아도 잘못오는데 오랜만의 여행고층건물들이 즐비하게 야경이 매우 아름답고 좋네요백사장이야 워낙 유명하니까 ~~~
부산,해운대,부산 일번지
부산,해운대,부산의 모든  것이  모여 있다고 해도 과언이 아닐 것. 부산 여행의 출발점이자 끝. 항상 활기가 넘치고 살아 있는 곳. 그 느낌만으로도  좋은 곳
부산,해운대,항상가는코스
부산,해운대,해운대는 부산여행하면 빠질수없는곳낮에도 예쁘지만 밤에 보면 주변 건물과 바다를 보는 풍경이 너무예쁜곳인듯합니다. 
부산,해운대,해운대 좋아용
부산,해운대,오랜만에 놀라왔는데 놀기도 좋고 바닷가 걷기도 딱 좋은 날씨에요 밖에서 맥주한잔하기정말 좋은곳이에요 맛집도 많아서 좋아요!
부산,해운대,아름다운 곳 해운대 마음이 편안하곳 해운대 사람이 많이 없어 당일 여행에 아주 만족했다.둘레길도 좋고 주변 환경도 좋았다
부산,해운대,밤바다가 아름다운곳
부산,해운대,"한국뿐만 아니라 전세계에서도 유명한 대표적인 해수욕장입니다.드넓은 백사장과 야간뷰,산책코스등등연인,친구,가족끼리 쉽게 방문하기좋은곳입니다."
부산,태종대,부산의 명소 중 하나.
부산,태종대,"자연경관보러 가기에 좋다. 풍광은 좋은 편이나, 나무에 가려진 곳이 많다. 등대나 전망대 쪽에서 보는 경관이 좋다.많이 걸어다녀야 하며, 등대카페와 그 아래도 내려갈 수 있으므로 취향에 맞게 가면 좋다. 등대건물은 현재 코로나로 인해 입장할 수 없지만 그 옆의 휴게공간인 등대카페는 정상운영중이다. 바람이 꽤 부므로 주의.개인적으로는 다누비 열차를 활용하는 것을 추천. 비수기의 다누비 배차간격은 20분정도. 자세한 것은 첨부사진 참조도보로 일주시 등대와 명소들을 다 본다면 3시간은 걸릴 것이다."
부산,태종대,비오는날 태종대일주하면 
부산,태종대,몸과마음이 상쾌해지는 느낌입니다.코로나로 닫혀있던 태종대전망대 휴계소가 열렸습니다.2층에는 새로만들어진 커피숖도 있습니다.등대와 태종사와 함께어우러져걷기에 정말 좋습니다.
부산,태종대,부산에 간다면 기본 코스
부산,태종대,"태종대 파도를 보고와야 부산에 다녀왔다고 할 것. 예전만큼의 감흥은 덜하지만, 부산을 처음 여행하는 사람들은 필수 코스임. "
부산,태종대,부산 최고의 바다 경치
부산,태종대,부산에 간다면 무조건 여기는 한바뀌 트레킹 하길 권한다. 절벽에서 보는 바다 경치가 정말 좋다. 시간적 여유가 있다면 윗길로 가서 도는 것이 좋을 것 같고. 없다면 아랫길로 가서 등대 쪽 전망대에서 경치보고 내려가서 배를 타고 이동해도 괜찮다.
부산,태종대,조용한 태종대
부산,태종대,코로나로 태종대 부비열차도 중단되었지만입장은 가능합니다.오전방문하시면 한적하게 사람도 없고좋습니다.전망대매점과 입구매점은 코로나로 폐쇄가되었습니다.자판기는 사용가능합니다.자갈마당과 전망대 코스로해서 한바퀴 일주하는데 2시간정도 잡으시면됩니다.전망대까지만 가시면 1시간 내외입니다.입구에 유료주차장이 세군데있습니다.
부산,태종대,부산의 끝자락 느낌
부산,태종대,영도에서도 끝. 대한민국 동남쪽 끝.분명 같은 시간 부산 시내는 맑은데 태종대는 앞이 안보일 정도로 안개가 자욱했다.굉장히 신기한 곳이다.
부산,태종대,밝은 햇살을 받으며 탁 트인 해안의 산책로.. 너무 좋아요.
부산,태종대,태종대 산책로를 천천히 걸어보세요.밝은 햇살과 맑은 바다 공기.. 탁 트인 해안의 절경을 감상하며 40분 정도를 산책했습니다.휴게소에서 차 한잔의 여유를 가지며 동행들과 행복한 시간을 보냈죠.
부산,태종대,다시와도 좋네요..
부산,태종대,경치도 좋고 산책하기도 좋은 곳입니다.2년 만에 다시왔는데.. 여름 겨울 다 괜찮네요..등대 전망이 좋고요..전망대는 2019년 12월 기준 수리 중이네요..빨리 보수가 되면 좋겠어요 
부산,태종대,부산의 자랑.. 태종대 해운대
부산,태종대,영도의 끝자락에 위치해 각종 자연의 모습과 산책하고 걷기에 너무도 좋은 곳... 부산에 왔다면 한 번은 꼭 들러야하는 곳. 위쪽이 해운대라면 아래쪽은 당연히 태종대이지요..가족끼리 연인끼리 산책하며 걷기에 가장 좋은 곳입니다.
부산,태종대,태종대에 올라가기위해 운영되고 있는 차 티켓을 구매한 후 차를 타고 올라가면 쉽고 편하게 올라 갈 수 있어서 좋았습니다 다만 정류장을 잘 몰라 놓칠 수 도 있으니 조심해야할 것 같습니다 
부산,범어사,여름에 피서하기 좋은 계곡
부산,범어사,부산을 내려다 보는 범어사.큰 도시에서 이런 절이 있는 것이 놀랍다.여름이면 범어사 아래 계곡 물이 흐를 때 물장구 잠시 치는 것도 좋다.물이 아주 시원하고 맑다.
부산,범어사,부산에서 제일 큰 사찰
부산,범어사,부산에서 제일 큰 사찰이자 전국적으로도 다섯 손가락 안에 꼽히는 고찰입니다. 찾는 사람이 많아서 산 속에 있음에도 교통도 편리한 게 장점.
부산,범어사,신라 의상대사가 창건한 고찰
부산,범어사,"신라 문무왕때 의상대사가 창건했으며 해인사, 통도사와 함께 영남의 3대 사찰로 부산의 대표적인 사찰입니다.  불교신자가 아니라도 천년고찰로서 볼거리가 풍부하여 내,외국인들이 많이 찾는 곳입니다.  또한 일반인들을 대상으로 템플스테이도 운영을 합니다.  오랫만에 찾았더니 통로 곳곳에 예쁜색깔의 등으로 장식되어 있어 정말 운치있었습니다.  지하철 1호선 범어사역에 내려서 5번 또는 7번 출구에서 주택가 방향으로 500m 정도 걸어가서 90번 버스를 타고 범어사 매표소 입구에 내리면 됩니다.  입장료는 무료입니다."
부산,범어사,부산의 명소... 범어사
부산,범어사,부산 끝자락에 위치해 수많은 관광객들과 스님들의 방문이 이어지는 곳. 수학여행도 소풍도 많이도 갔던 기억이... 엣날의 고취는 여전히 남아있는데 주변환경은 변화가 있었네요. 그래도 옛 추억이 살아있는 곳입니다.
부산,범어사,부산의 대표적인 절이다. 산 중에 있어 절 방문뿐 아니라 등산을 하고 싶은 사람들에게도 좋은 등산 코스를 제공한다. 불교 행사때 방문해보면 여러 이벤트들을 체험해볼 수 있다.
부산,범어사,매우 아름답다. 산책하기에  좋은 장소이다. 맑은 공기와 아름다운 경치가 매우 좋은 장소이다. 범어사까지 가는 길에 우거진 숲의 경치는 기분을 좋게 한다.
부산,범어사,추천
부산,범어사,부산에서는 단연 빼어난 절입니다. 산세가 좋고 고찰의 분위기가 남아 있으며 대중교통으로 어렵지 않게 접근할 수 있습니다.
부산,범어사,가볍게 다녀올 수 있는곳
부산,범어사,"지도로 봤을때는 산을 꽤 올라가야해서 걱정했는데, 다행히 주차장과의 거리가 멀지 않았습니다. 무료경내 주차장은 줄이 매우 길고요. 버스정류장 옆 주차장은 주말에 3천원 정도 내는데 공간이 좀 빕니다."
부산,범어사,범어사 단풍 멋있어요~
부산,범어사,"부산 여러번 가봤지만, 범어사는 한번가봤어요~범어사 단풍 정말 예뻐요특히 해지기 직전 햇볕과 반짝이는 범어사 단풍 정말 예뻐요"
부산,범어사,"금정산 맑은 공기와 아름다운 사찰, 주변의 예쁜 카페까지^^"
부산,범어사,"범어사는 주차이후 언덕길이 거의 없어 아이들과 산책하기도 좋습니다. 사찰 규모도 큰 편입니다. 범어사를 둘러보신 후, 주변 카페에서 차 한 잔 하시며 금정산을 느껴보세요."
부산,광안리해수욕장,바람쐬러
부산,광안리해수욕장,맛집도않네요특히 무한리필 홍게집에서 맛있게먹고멋진 오션뷰가 좋네요데이트하기 좋습니다.한참 게가살이 많을땝니다
부산,광안리해수욕장,광안리 해수욕장 방문
부산,광안리해수욕장,넓고 사람이 많음. 주변 카페나 음식점과 해변까지의 거리가 가까워서 식당 창가에 앉으면 해수욕장과 광안대교를 즐길 수 있음. 찻길이 바로 붙어있고 쌩쌩 달려 길 건널때 조심해야 함.
부산,광안리해수욕장,여ㅗㅔㅇ
부산,광안리해수욕장,야경이 좋은 광안리 해수욕장여기저기에서 버스커하는 모습 아주 좋았다.모래사장에 설치된 광안리 푯말  사진촬영하기 좋은곳이다.
부산,광안리해수욕장,부산의 대표적 해수욕장
부산,광안리해수욕장,"수영구에 위치한 광안리해수욕장입니다.해운대 다음으로 유명한곳입니다.공영주차장은 가까운데 위치하고있지않습니다.광안대교의 뷰가 환상적인곳입니다.가족,연인,친구들과 함께하기좋습니다."
부산,광안리해수욕장,여름의 해변은 비록 모르지만.
부산,광안리해수욕장,겨울의 송정 해운대 광안리 중에서는 광안리가 제일 좋았다.해안가 바로 가까이에 모든 상가가 활발하게 영업중이었다. 해운대도 그렇긴 하지만 해운대는 약간 빌딩 호텔 이런 느낌인데광안리는 생활권느낌이 강했다. 더 자유로운느낌을 받았다 그리고 해변도 엄청 넓고
부산,광안리해수욕장,야경이 아름다운 해수욕장
부산,광안리해수욕장,해운대해수욕장과 더불어서 부산에서 가장 유명한 해수욕장 중 하나. 모래가 좀 더 딱딱한 편. 가장 큰 특징은 광안대교가 한 눈에 보여 야경이 매우 아름답다는 점입니다.
부산,광안리해수욕장,겨울에도 운치있는곳
부산,광안리해수욕장,광안대교도보이고 가을에는 불꽃축제도하고 나들이 하기좋은곳입니다근처에 맛집들과 카페가 많아요교통도 편리한곳
부산,광안리해수욕장,여기는 겨울에 가도 좋아여
부산,광안리해수욕장,한국에 이렇게 관리 잘 되는 해수욕장 없을거임겨울에도 주변에 먹을 곳 많고깨끗함 언제나 사람이 많은 편임이것저것 잘 꾸며놔서 물에 못 들어가도 괜츈
부산,광안리해수욕장,따뜻한 겨울바다
부산,광안리해수욕장,부산에서 태어나 대학때부터 광안리 근처 살았다 현재는 대구에 살지만 어머님께서 아직 광안리 사셔서 1년에 몇 차례 씩 내려 간다.  최근 광안리가 많이 새롭게 변하고 있는 것 같다 부산시에서 관리를 잘하고 또 주변많은 새로운 찻집과 새로운 음식점 그리고 주변이 깨끗하여 지며 관광지로 탈바꿈 하고 있다그래도 바다가 멋진 곳이다광안대교가 바다 가운데 있다
부산,광안리해수욕장,부산의 명소.. 젊음과 낭만이 숨쉬는 곳.
부산,광안리해수욕장,예전부터 광안리는 젊음의 상징이었지요. 물은 더러워서 수영은 하기 그렇지만 바다가 있다는 사실만으로도 충분히 그 역할을 다 하고 있는 곳입니다. 젊은이들이 쉴 수있는 공간이 많지만 그 만큼 어지러운 곳이기도 한 양면성이 있는 듯요...
부산,광안대교,해질녁이 너무 좋아요
부산,광안대교,겨울은 조금 추워서 그렇지만 봄 가을이면 해질녁에가셔서 노을지는 하늘과 해진후 야경을 보시면 좋을듯 합니다주변에 가볍게 술을 마시기에는 분위기가 좋지만 다른곳에 비하여 가격은 조금 나갑니다
부산,광안대교,부산만이 가지고 있는 감성을 느낄 수 있는 곳.
부산,광안대교,호텔에서 잠시 나와 기분전환겸 산책할때 봤던 광안대교. 다리가 만든 야경은 부산의 감성을 제대로 느끼게 해주는 능력이 있었습니다:D 다시 방문하고 싶은장소!👍👍
부산,광안대교,넘  이뻐요!!
부산,광안대교,광안리 아웃백갔는데 광안대교도 보이고 이뻐요~~!! 맛있는것도 먹고 뷰도 보고 ㅎㅎ완전 좋았어요!!ㅋㅋㅋ 다음에 또 먹으러 가야겠어요!!!
부산,광안대교,야경보기좋은곳
부산,광안대교,낮에는 크게 흥미가없는곳이지만 밤에보기엔 너무 좋은곳호텔오션뷰에서 봐도좋고  특히 요트투어로   가까이에서  보는걸추천
부산,광안대교,바다
부산,광안대교,바다.... 더 이상 말이 필요한가요..여러분도 시간나시면 광안리에 한번 가보세요광안대교를 바라보며 맥주한잔 하고 싶네요정말 좋아요
부산,광안대교,한국최고의 브릿지
부산,광안대교,"다이아몬드브릿지로 유명한 광안대교는낮보다 밤이, 화려합니다.광안리해수욕장에서 바라보면 정말 아름다운곳입니다.연인,가족,친구들과 함께 하면 정말좋습니다.매년 10월에는 부산국제불꽃쇼가 진행됩니다."
부산,광안대교,광안리
부산,광안대교,바닷가의 해변에서 아름다운 광안대교를 바라볼 수 있습니다. 주변에 다양한 카페와 식당들이 있으며 해변에 위치해 있는 거의 모든 장소에서 낮에는 바다와 어우려진 아름다운 다리를 볼 수 있으며 야간에는 조명과 함께 빛나는 색다른 모습을 감상할 수 있습니다.
부산,광안대교,부산을 상징하는 야경
부산,광안대교,광안리 해변에서 광안대교를 바라보면 정말 멋지다.여름이라면 밖에서 봐도 좋으나 차가워진 날씨라면 광안리 해변도로를 끼고 있는 식당이나 까페에서도 볼 수 있다.
부산,광안대교,멋진야경
부산,광안대교,저녁에오면 다리랑 건너편 해운대 아파트뷰랑 어울려서 이쁜 야경을 볼수있는곳.낮에도 바다보고 다리보고있으면 힐링되요
부산,광안대교,야경
부산,광안대교,야경이 좋다 부산에서는 여기가마린시티 야경도 보고최고입니다 그리고 저는 개인적으로좋았어요 주위에 맛집들이 즐비합니다메뉴도 다양하게 있어서 좋고요주차도 그냥 도로에 가능해서편리하고 ~~~~
부산,UN기념공원,가족과 함께 산책하기 좋은 곳
부산,UN기념공원,유엔공원은 조용하고 안전한 공원입니다~아이들과 함께 둘러보기 좋아요~작은 호수에 오리와 있어요 사직찍으면 외국같은 분위기~요즘 코로나로 해외나기기 힘든데 갈볼만 해요~무료입장~
부산,UN기념공원,한국전쟁 당시 한국을 위해 싸우시다 전사한 UN군 분들의 유해가 묻혀 있는 곳.우리나라가 아예 UN에 기증을 한 독특한 장소입니다. 
부산,UN기념공원,un기념공원
부산,UN기념공원,한국전쟁때의 용사들을 기리는 공원이다. 추모의 의미와 더불어 시민들이 공원을 즐길 수 있도록 잘 정비해놓아서 가볍게 산책하기 좋은 공원이다. 
부산,UN기념공원,세계에서 유일한 UN군 묘지
부산,UN기념공원,"토지를 유엔에 영구기증하여UN참전용사의 유해를 관리하고 있음계절마다 아름답게 가꾼 화초와추모기념비  등을 보실 수 있습니다 정문은 김중업 건축가의 설계로건립되어 부산시 근현대  문화유산으로지정되어 있습니다.입장료는 무료이며, 입장시에는  단정한 복장을 준수해야 합니다.  정문에는 위병이 서 있어서  출입이  불허될 수 있습니다."
부산,UN기념공원,감사합니다
부산,UN기념공원,어린 나이에도 타국을 위해 전쟁을 참여한 이들의 무덤을 보니 가슴이 먹먹했습니다. 공원도 그분들에게 감사하는 마음을 표시하는 것만큼 정성스럽게 잘 만들었습니다. 
부산,UN기념공원,별 이유 없이 방문 했다가 감동 받았습니다.
부산,UN기념공원,제가 부산에서 가장 좋아하는 장소 중 한 곳 입니다.가슴 아픈 우리나라의 역사를 간직한 곳이자 위로하는 곳.마음이 아프면서도 편안해 지는 곳입니다.
부산,UN기념공원,외국인이 더 자주 찾는 곳
부산,UN기념공원,유엔 기념공원은 전 세계에서 유일하게 한 곳 이 곳 부산 남구에만 위치하고 있습니다.앞으로도 더욱 많은 사람들이 찾기를 바라는 바입니다.
부산,UN기념공원,꼭 방문해.보세요
부산,UN기념공원,부산에 살면서도 유엔국립묘지를 방문한것은 처음이었다.생각했던것보다 훨씬 멋지고 경건하게 조성된곳이었다.지금의 우리를 그리고 앞으로의 우리가 살아갈 시간들을 깊게 생각할수 있는 곳이었다.부산에 여행을 오는 사람들과 부산시민들 모두 한번씩은 방문해보시라고 권하고 싶은곳이다.
부산,UN기념공원,UN기념공원 산책 겸 연인과의 데이트 짱!
부산,UN기념공원,역사 깊은 곳 UN기념 공원 그리고 국화축제UN공원은 부산에서도 굉장히 유서 깊은 곳이고또한 많은 의미를 담고 있는 곳이다.그래서 그런지 들어갔을때 느껴지는 UN공원만의 분위기가 있다.포근하지만 차분한 분위기그런 분위기 안에서 국화 축제는 정말 공원을 거니는 사람들의 마음을더 따듯하게 만든다.국화축제를 즐기고 UN공원을 돌아보기 위해서짐을 들고다니면 굉장히 불편할 때가 많다물론 앉아서 쉴수 있는 공간도 마련되어 있지만 그래도짐을 들고다니기에는 한계가 있다.그럴때 부산의 짐 보관소를 한번에 찾을 수 있는 Bag Station이 있다면굉장히 큰 도움이 될것 같다UN공원을 갈때 주변상점에 짐을 잠시 맡겨두고공원과 국화축제를 다 즐기고 돌아 올때 찾는다면정말 편하게 더욱 UN공원을 즐길 수 있다.
부산,UN기념공원,부산에서 가볼만한 곳
부산,UN기념공원,제가 남구 쪽에 살았는데 세계 유일하게 유엔평화공원이 한국 부산에 있다고 하더라고요 정말 가볼만하데요 꼭 가보시길 바랍니다
부산,송도해상케이블카,비지니스
부산,송도해상케이블카,"해상케이블카는 꼭한번은 타보세요...건너편에도 볼거리, 먹거리, 산책코스, 그리고 그곳에서 바라보는 전망은 힐링 제대로 됩니다."
부산,송도해상케이블카,송도에 갔다면 한 번 타볼만함!!
부산,송도해상케이블카,"크리스탈(바닥유리)이 5천원 가량 더 비싼데 굳이 크리스탈 안 해도 될듯합니다. 어차피 바닥은 바다만 보여서 주변을 더 둘러보기때문에 굳이...?!?!? 잘 찾아보시면 할인혜택있으니 할인 받으면 좋아요(srt,ktx 승차권 있으면 할인 됐었음)개인적인 추천코스가 있다면.. 1. 해지기 좀 전에 케이블카 편도로 타고감.2. 케이블카 내리면 테마공원처럼 이것저것 꾸며놓은 것 있어서 사진찍고 놀기 좋음.3. 해가 질 때쯤이면 케이블카에도 불이 들어오고 송도앞바다 야경 구경 가능.4. 암남공원 쪽으로 내려오면 조개구이 포장마차 있음5. 조개구이 1점, 소주 1잔 = 끝~^.^~6. 택시타고 남포동으로!"
부산,송도해상케이블카,거리에 비해서 비싸지만 꼭 한번 타볼만한 해상케이블카
