region,attraction,article
부산,암남공원,부산 사람으로 암남공원은 자주 방문했었습니다.이번에 송도 용궁구름다리가 오픈했다고 하길래 다시 방문을 했습니다.바다위를 걷는 느낌의 다리라고 해서 한 껏 기대를 하고 갔는데 바다를 걷는 것 같은 느낌은 살짝 부족했던 것 같습니다.다른 구름다리 처럼 강화유리로 만들어졌다면 더욱 스릴 있고 멋진 경험을 선사해주는 공간이 될 것 같은데 조금 아쉽네요.하지만 송도와 암남공원을 방문해야 하는 이유가 하나 더 늘었다는 것에 만족스럽습니다. 송도가 점점 발전하고 즐기고 볼거리가 늘고 있어 부산 사람으로 뿌듯하네요.암남공원 리뷰인데 다른 이야기만 했네요.송도 암남공원은 자연 섬 공원으로 한적하게 산책하기 정말 좋은 곳입니다. 그 어디에가도 이런 경험을 쉽게 할 수 없을 정도로 말이죠.어메이징한 곳이니 부산에 오신다면 꼭 방문을 해보세요!
부산,암남공원,서구 암남동에 있는 공원인데 좋았습니다. 자연 섬으로 되어있어 너무 좋았고  아주 좋았습니다. 강추드리고요 다음번에도 올 계획입니다.
부산,암남공원,산책길따라 걸으면서 바다를 한눈에
부산,암남공원,송도해수욕장 주변에서 케이블카 타고 가는데 풍경에 좋습니다. 산책길이 만들어 져 있는데 걸어가다 보면 섬 정상에 다달아 바다를 한눈에 볼 수 있습니다. 바닷가를 끼고 걸어가다 보면 어느새 스트레스가 날라가네요. 산책 좋아하시는 분들이라면 충분한 시간을 가지고 오세요.
부산,암남공원,암남공원 꼭 가자
부산,암남공원,서구 암남공원은 부산에서 가장 유명한 해상 공원 중 한 곳입니다. 서구는 원도심으로서 예전부터 사람들이 많이 살고 있습니다. 암남공원도 시민들이 많이 찾는 곳입니다.
부산,암남공원,낚시하러 마니 가는곳
부산,암남공원,부산 사람들이 낚시하러 마니 가는 곳조개구이 촌도 있는데 지금도 있나 모르겟지만비싸고 양적음 낚시하러 가세요 고고싱
부산,암남공원,부산 자연풍경 구경할 수 있는 암남공원
부산,암남공원,자연 풍경을 구경할 수 있는 또다른 부산의 관광명소 태종대만큼은 아니지만 데이트하고 바다 구경하기 좋은 곳이란 생각이 든다.
부산,암남공원,경치좋은 공원
부산,암남공원,송도케이블카 내리면 있는 공원입니다. 소소하고 재밌는 이벤트도 하고 무엇보다 바다가 보이는 산책로가 일품입니다. 날씨가 좋아서 정말 기분좋았어요!!
부산,암남공원,케이블카타고 가기좋은곳
부산,암남공원,송도케이블카 타고 딱 내리면 있어요. 날씨가 좋아서 경치가 정말 멋졌어요. 간식거리도 팔고 공원과 산책로도 예쁘게 잘 되어있어요
부산,암남공원,자주가요
부산,암남공원,어렸을때 여름에 더우면 가던 곳인데 옛날생각나서 자주 가요겨울엔 겨울대로 차안에서 따뜻한 핫초코 먹으면서 있으면 좋구 여름엔 여름대로 좋아요 
부산,암남공원,"송도 케이블카 이용 후, 방문 가능한 곳."
부산,암남공원,"최근 송도 케이블카 이용 후, 산챈로를 따라 걸어가며 구경할 수 있었습니다. 추운 날씨였지만 경치를 즐기며 편안한 산책이 가능하였습니다."
부산,벡스코,벡스코 진짜크네
부산,벡스코,국내 행사장중에 가장큰거같다 킨텍스가 두개가있긴한데 단일규모로는 제일크지 않나..정말 크다고 느껴졌다. 아침에 가서 그런가 한산하네 벡스코 행사조회해보면 매주 행사가 열린다.
부산,벡스코,각종 행사가 열리는 장소
부산,벡스코,부산에서 큰 행사가 열리면 꼭 쓰이는 장소. 지스타나 부코도 여기서 열리고 여러 일로 종종 들르게 되는 곳. 좀만 더 가면 신세계 백화점도 있고 은근 놀 데 많습니다.
부산,벡스코,지스타
부산,벡스코,지스타 행사에 방문했습니다~ 실내가 따뜻하여 좋았던것으로 기억합니다. 야외에 넓은 광장이 있어 야외행사에도 좋을것같습니다! 주변에 음식점이나 카페가 많아 편리했고 백화점이 있어서 짐보관등에도 유용했어요
부산,벡스코,벡스코는 서울의 코엑스 일산의 킨텍스 처럼 전시 등을 하는 컨벤션 센터이다. 여러 전시들을 개최하니 홈페이지에서 일정을 확인하고 관심있는 전시를 방문해보면 좋을 것 같다.
부산,벡스코,출장
부산,벡스코,"벡스코 채광이 넘 좋은 박람회 장.. 단 여름에는 실내에 에어컨을 켜도 채광이 넘 좋아, 햇볕이 있는곳은 더움. 작년까지 백스코에서 행사하다가 너무 더워 롯데호텔로 행사장 변경했음. 겨울엔 짱 좋음."
부산,벡스코,큼직한 전시를 즐길 수 있음
부산,벡스코,부산에서 큼직한 전 시대를 즐길 수 있는 곳입니다 하지만 서울에 코엑스 보다는 규모가 훨씬작고 복합적으로 즐길 거리도 많지 않습니다
부산,벡스코,다목적으로 이용되는 시설
부산,벡스코,"벡스코에서는 총회, 세미나, 전시회, 공연 등 다양한 유형의 행사를 개최할 수 있는 시설을 완비하고 있습니다.  2005년에 APEC 정상회의, 2014년에 한-아세안 특별정상회의 등 중요한 회의를 개최했습니다.  이런 정상급 회의도 개최되지만 가끔씩 이름없는 브랜드의 의류 또는 신발들을  땡처리하는 공간으로도 사용되기도 합니다.  본관도 넓은데 맞은편에 신관을 건설했습니다. 이 넓은 공간들이 할용도가 높아야 할 텐데..."
부산,벡스코,너무 기대를 했어서 그런지 생각보다 별로 였어요볼것들이 많지도 않았고 사람들도 많고 그냥 지루한 느낌? 뿐이였던거 같아요 
부산,벡스코,다양한 전시회와 콘서트를 즐길 수 있는곳!
부산,벡스코,"백스코는 부산에서 전시회와 콘서트등을 가장 크게 즐길 수 있는 곳입니다. 다양한 기업들의 전시회와 박람회를 통해서기업 제품을 싸게 살 수도 있고몰랐던 기업들에 대해서도 알 수 있습니다.또한 콘서트도 자주 열려서 즐거운 문화생활을 할 수 있습니다.해운대 광안리와 가깝기 때문에 콘서트도 보고 해운대와 광안리도 즐길 수 있습니다.박람회와 콘서트를 즐기려면 짐 보관이 필수에요.들고있던 가방, 쇼핑백등은 콘서트나 박람회, 전시회에서 정말 큰 불편함을 느낄겁니다.주위에 백화점이 있어서 백화점내의 무료 보관소에 맡길 수 도 있습니다. 꼭 짐을 맡기고 백스코를 즐기세요!혹시 백화점의 무료 보관소에 공간이 없다면 Bag Station서비스를 이용해 보세요. 백스코 근처의 매장에 짐을 보관할 수 잇어서백스코를 3배 더 즐길 수 있을거에요!"
부산,벡스코,오랜만에 벡스코 다녀와서 이것저것 행사 많으니 자주 가게 되는듯 해요행사ㅜ있을때마다 가게 되는듯담에 또 가겟죠 여긴..
부산,더베이101 요트클럽,해운대의 새로운 명소!
부산,더베이101 요트클럽,동백섬의 입구 해변에 위치한 곳으로 요트 클럽을 표방하지만 건물 안에도 음식점과 상점 등 다양한 시설들을 갖춘 복합적인 문화공간이다. 주위 바다 너머의 모습도 인상적인 곳으로 새로운 사진 포인트가 되는 또 다른 명소!
부산,더베이101 요트클럽,젊은의 활기를 느끼기에 좋은 곳
부산,더베이101 요트클럽,"부산에 가면 해운대에 가게 되고 해운대에 가면 갈 수 밖에 없는 곳 중 하나예요. 여름에 가면 특히 야경을 즐기면서 옥상에서 맥주한 잔을 안 할 수 없는데, 젊은 사람들만 모인 곳이라 시끌 시끌 하지만, 정말 그 분위기에 취해보고 싶다면 꼭 가보시길. 아무도 신경 쓸 필요없고, 아무도 신경쓰지 암ㅎ읍니다. 모두 젊음에 취해 있으니까..."
부산,더베이101 요트클럽,한시간의 힐링
부산,더베이101 요트클럽,보는 거와는 다른 느낌의 요트투어제일 윗쪽보다는 맨앞 쪽이 사진찍기에좋은듯하며바닷바람이 생각보다 추우니 따뜻한옷이 필수인투어
부산,더베이101 요트클럽,야경 명소
부산,더베이101 요트클럽,보통 부산 해운대나 센텀시티를 보여줄 때 나오는 화려한 야경을 볼 수 있는 지점입니다. 사진작가들도 많이 찾는 꽤 유명한 사진 스팟.
부산,더베이101 요트클럽,야경을 보기에 아주 좋습니다
부산,더베이101 요트클럽,부산의 야경 명소로 손꼽히는 곳입니다 특히 사진을 찍었을 때 아주 잘 나오는 것 같아요 해운대와 가까워서 함께 방문해보기를 추천하는 곳입니다 
부산,더베이101 요트클럽,사진
부산,더베이101 요트클럽,뷰가 정말 끝내줍니다. 부산에서 가장 멋있는 건물 뷰인 것 같아요. 삼각대는 꼭 가져가시길 바랍니다 (최대한 낮은 삼각대가 좋아요)
부산,더베이101 요트클럽,부산에서 가장 인기있는 관광지중 하나입니다 특히 밤에 사진찍기 굉장히 좋은 곳이며 많은 사람들이 여기 아파트를 배경을 사진을 찍으러 방문합니다 안에서 간단하게 맥주와 안주류를 사서 먹을 수 있지만 가격이 조금 비싸요 
부산,더베이101 요트클럽,Alive spot in Busan
부산,더베이101 요트클럽,"예전엔 조선호텔과 동백섬만있던 곳인데 지금은 요트클럽과 음식점, 문화공간으로 조성되어 많은 사람들이 찾아오네요. 특히 저녁무렵 주변에 조성된 마천루 빌딩의 야경을 즐기러 많은 사람들이 더베이101 데크에서 인생샷을 찍네요. 여기가 싱가폴인지, 홍콩인지 구분이 안가네요. 정말 좋은 야경입니다"
부산,더베이101 요트클럽,더베이101
부산,더베이101 요트클럽,해운대 바닷가 근처에 있는 곳이다. 특히 야경이 멋진 곳이고 뒤에 아파트들을 배경으로 멋진 야경 사진을 찍을 수 있는 곳이다. 해운대 간다면 인생사진을 찍을 수 있는 장소로 추천한다.
부산,더베이101 요트클럽,지나가며 야경보기 좋은 곳
부산,더베이101 요트클럽,저는 저녁 먹으러 식당 가다가 지나는 길에 들렀는데 가볍게 야경을 보기 좋은 곳이에요. 굳이 멀리서 찾아갈 필요는 없는것 같아요ㅎ
제주,제주 돌문화 공원,"엄청 넓어요 부지가 매우 넓고 실내 전시관도 넓네요. 모든게 다 넓고 커요. 가을이라 억세가 만발했어요. 날씨 좋은날 갔더니 사진도 이쁘게 나오고 좋네요. 이름만 들었을땐 따분한 느낌이었는데, 나쁘지 않았어요. 조용히 제주를 느끼기에 좋아요"
제주,제주 돌문화 공원,제주도 최고의 문화 공원 돌에도 문화가 있다는 것을 깨닫게 해주는 공원. 돌의 문화에 대해서 배우고 구경하고 공부하다 보면 정말 기분 좋은 느낌을 느낄 수 있다.
제주,제주 돌문화 공원,"산책, 문화탐방에 최적 2시간정도 여유있게 걷기 좋고 다양한 돌조각, 전통집이 훌륭합니다. 민속마을보다 잘 정리된 다양한 전통집. 천천히 보면 3시간 정도 소요됩니다 "
제주,제주 돌문화 공원,모든게 다 좋았습니다. 리뷰가 좋아서 선택한 장소 입니다. 정말 추천하는 장소 입니다. 이 날 비도 조금씩 오고 무엇보다 안개가 심하게 끼어 원경이 거의 보이지 않았지만 그래도 다녀온 게 정말 좋았다고 느끼고 있습니다. 안개 낀 것도 나름 분위기가 좋았구요박물관과 전체 공원의 구성이 아주 좋고 볼거리도 많습니다. 개성있어요. 맑은날 또 가보고 싶네요.
제주,제주 돌문화 공원,"돌이 멋있을까? 하는 의문을 풀어준 곳 가기로 한날 마침 비가와서 좀 스산했는데, 그게 훨씬 돌문화공원의 느낌을 잘 느낄 수 있엇던것 같아요. 돌과 빗물과 파릇한 풀의 조화 덕분에, 자연을 흠뻑 느끼고 왔네요. 주변에 뱀이 많으니 꼭 조심하시구요. 곳곳에 포토스팟에서 인생샷도 꼭 남기세요"
제주,제주 돌문화 공원,제주의 명소 중의 하나 제주도에 가서 두 번 들리는 곳이 몇 안되는 데 이 장소는 재 방문할 만한 가치가 있습니다. 취향 나름이겠으나 전체를 다 보려면 3-4시간은 걸리지만 충분히 할애할 만한 가치가 있습니다. 아이들은 그다지 좋아하지 않을듯 하나 장년층은 유유자적 산책삼아 둘러보면서 넓은 경관을 즐기기에 적당합니다. 경로자는 무료 입장입니다.
제주,제주 돌문화 공원,"제주에 가면 꼭 들여야 할 곳 중 하나! 제주도의 전반적인 역사를 볼 수 있는 돌문화공원..공원안의 박물관에는 제주도의 생성 및 기원에 대해 잘 알 수 있도록 되어 있습니다.그리고 돌길을 걸으며서 다양한 돌과 전통돌한마을을 구셩할 수 있습니다.오백장군 갤러리, 숲길 등 너무 잘 꾸며 놓았습니다.입장료는 5,000원입니다.그러나 입장료가 아깝지는 않은 것 같습니다."
제주,제주 돌문화 공원,삼다도의 특징을 잘 보여주는 곳 삼다도라 돌이 많은 제주. 화산과 돌맹이들로 가득찬 제부에서 돌을 테마로 이렇게 해 놓으니 다른 곳에서는 구경할 수 없을 특색있는 곳이라 좋습니다. 꼭 한 번 방문해보시길...^^
제주,제주 돌문화 공원,멋있어요 제주도에서 무언가를 살 때 하루방이 있는 걸 꼭 살 만큼 돌이 유명하잖아요. 여기 가니 하루방들 사이에 둘러쌓여있는 느낌이었어요.
제주,제주 돌문화 공원,비오는 날도 좋아요 비오는 제주의 돌문화 공원.운치있고 좋아요.제주여행시에는 우의를 필수로 지참하세요.탁트여서 좋고 사진찍기 좋아요.원시적인 제주의 돌.
제주,제주 돌문화 공원,콘텐츠가 알찬 돌문화 공원 테마가 있고 배울 것이 너무 많은 곳 주변 경관도 너무나 아름다운 곳 입장료가 절대 아깝지 않은 곳아름다운 건축물 볼 만하고 그에 절대 모자라지 않는 콘텐츠꼭 가보시길 권장합니다. 단 주변 경관상 식당 매점 없으니 간식 준비해 가세요~하루 종일 있어도 지루하지 않은 곳이 될거예요~~
제주,제주 돌문화 공원,세번째 방문 제주도 여행을 자주 하는 편인데 돌문화공원을 좋아해서 이번이 세번째 방문입니다. 박물관 뿐만 아니라 주변을 걷다보면 마음이 차분해지고 경건해집니다. 혼자 와도 좋고 가족들과 같이 와도 좋은 곳입니다. 다음에도 또 오고 싶습니다. 
제주,제주 돌문화 공원,아무기대 안하고 갔는데 인생샷 건지고 왔어요 아무런 기대도 안하고 갔는데너무 넓고이쁘게 잘꾸며져 있고관광객도 별로 없고해서커플사진 정말 많이 건지고 왔습니다꾸며놓은것도 숲과 돌이 너무 잘 어우러져서 벌레는 좀 있긴했는데 재밌게 잘 구경하다 왔어요! 주차장도 넓고 좋습니다.
제주,제주 돌문화 공원,돌하르방 제주하면 떠오르는 대표적인 돌하르방돌문화 공원인데 정말 아기자기하게 잘 꾸며놨더라구요 구경거리도많고 추천해요
제주,제주 돌문화 공원,"멋집니다 제주에서만 갈수있는 공원이라 생각하고 들렸는데, 규모가 생각보다 커서 시간도 많이걸린만큼 구경도많이하고왔어요"
제주,제주 돌문화 공원,제주 돌박물관 선문대 할망과 500장군의 설화를 바탕으로 넓은 면적에 2020녀까지 개발예정이래요 500명의 아들 돌문화 생태공원입니다.
제주,제주 돌문화 공원,다큐멘터리 같은 공원 석양이 질무렵 방문 추천..가족 연인과 함께하기 좋음그늘이 없어 아쉬움박물관에서 많은것을 배율 수 있다
제주,제주 돌문화 공원,방문할만한 돌문화 공원 제주도의 흔한돌을 전시한건이 아닌제대로 지어진  박물관멋진풍광학습자료더울때도 방무가능가슴을 시원하게하는 물과돌의 정원제주도에 여러번 와본 분들에도 추천
제주,제주 돌문화 공원,가장 제주다운 모습을 보이는 관광지 중 하나입니다. 제주도는 널린 게 돌입니다. 하지만 널렸다고 해서 쉽게 생각하면 오산입니다. 이 곳은 아마 국내에서 유일한 돌을 주제로 한 공원인 것으로 보입니다. 제주도의 역사와 함께 돌에 대한 모든 것을 이 곳에서 볼 수 있습니다.크게 세 가지의 코스로 나뉘어져 있으며 이 코스를 모두 돌려면 적어도 2시간 반 이상을 잡아야합니다.자연휴양림 안에 있는 공원이라 약간 외진 곳에 있지만 에코랜드 테마파크의 바로 길 건너에 위치해 에코랜드를 가신다면 무조건 가시길 추천합니다.남녀노소 모두에게 적합한 관광지이며 진정한 제주도에 대해서 알 수 있는 몇 안되는 관광지이기 때문에 정말 추천합니다.
제주,제주 돌문화 공원,여행 규모가 대단했던 공원입니다..  이상하고 환상적인 돌들과  시원한 바람과제주의 돌과 하늘을  같이 경험할 수 있는 공간입니다..   한시간 이상을투자해야  제대로 된 구경을 할 수 있는 곳입니다..
제주,제주 돌문화 공원,부모님이 좋아하십니다 3개의 코스로 이루어져 있으며다 돌아보려면 3시간은 잡아야 할듯 합니다.규모가 엄청나게 거대합니다.특히 실내전시인 1코스가 볼만하며부모님과 아이들 모두 같이 갔었는데어르신들이 더 마음에 들어했습니다.아이들은 살짝 지루할 수 있으며내부에 까페같은 공간이 없어간식이나 쉼터가 부족합니다.
제주,제주 돌문화 공원,"돌도 예술이다 돌문화공원에 한번 가봤는데, 정말 여기에 모아놓은 돌들은 전부다 예술적 가치가 있는 예술품 같았어요. 비오는날 부담없이 걸으면서 보기에 좋아요."
제주,제주 돌문화 공원,개인적으로 가장 맘에 드는 에코 랜드에 바로 있어서 별 기대안하고 갔는데 아주 좋아요. 개인적으론 흐린 날 이른 아침 비오는 날 등등 날씨에 따라 다시 방문하고 싶네요. 사람이 없어서 호젓하니 더욱 좋고. 게다가 박물관의 세련됨이나 크기가 놀랄 만큼 좋아요. 매표소에서 유모차도 대여가 가능. 
제주,제주 돌문화 공원,"아주 멋진 곳이에요. 드넓은 곳에 많은 돌문화유적을 모아 두었는데,잘 정리되어 있어서 박물관 등 볼거리가 많습니다.흔한 돌이 예술작품이 될 수 있다는 것을 보여주는 곳입니다.자연을 좋아하는 사람이라면 한 번쯤 반드시  가볼만한 곳입니다.저희는 다음 번에 긴 시간을 내어서 또 가볼 예정입니다."
제주,제주 돌문화 공원,"벌써 2번째 방문 재작년에도 갔었는데, 올해도 또 갔음. 이번에는 부모님을 모시고 감. 제주라는 화산섬이 어떻게 생겼는지를 잘 알 수 있는 박물관과 미적으로 아름다운 돌 전시관, 제주풍습을 직접 확인할 수 있는 민속 가옥들... 여러가지를 한번에 구경할 수 있어서 좋음. 게다가 30만 평 대규모라 풍경도 아주 멋있음. 그리고 이번에 갔을 때는 마침 '문화가 있는 수요일'이라서 입장료가 공짜였음!"
제주,제주 돌문화 공원,제주 돌 문화 공원 방문~ 어린이가 있는 가족여행객들이 가면 참 좋을것같아요^^ 사진찍기도 좋구요~~ 많이 걸어야하니 운동화 필수입니다!!
제주,제주 돌문화 공원,한번은 가볼만한곳 아이들이 있다면 한번은가봐도 좋을것 같아요.하지만 추울때 가는건 비추에요..수요일에 무료로 관람할수있으니 그때가는걸 추천해요
제주,제주 돌문화 공원,매주 마지막주 수요일에 무료로 관람할 수 있어요! 수요일 여행이었는데 마침 무료 관람이 가능했던 날이라서 재미있게 둘러봤습니다. 대신 날씨가 너무 추웠기 때문에 따뜻할 때 방문하는게 좋겠어요.
제주,제주 돌문화 공원,호불호가 갈리는곳 커피를 마시던중 사장님 추천으로 방문했는데 별로였어요크기는 엄청 큰데 저희들은 별로였네요입장료도 있고 한번은 갈만한데 두번은 가고싶지 않네요그런데 시설은 잘되어있어요
제주,제주 돌문화 공원,한번은 갈 만하나 두번은 절대 가고싶지 않은 곳 목석원이었을때 아기자기한 면면이 생각나서 가보았으나 황량한 벌판에 돌들이 잔뜩 있는 곳이었다. 추울때가서 그런지 더 황량해 보였다.차라리 바로 옆 교래 자연휴양림이 낫겠다.
제주,제주 돌문화 공원,좀 무서웠어요 . 저는 5000원내고 제주시티투어 동문시장에서 타고 갔는데요.겨울이라서 그런지 좀 무서웠어요 친구와 저밖에 없었거든요 입장료는 5천원 정도 였고요 . 중간중간 무덤이 있어요 ㅜㅜ
제주,제주 돌문화 공원,낮 보단 밤에 더 멋진 공원 제주도의 다양한 돌들과 넓은 잔디밭을 만끽할 수 있는 공원입니다.해가 지고 어두워졌을 때 조명을 받아서 연출되는 분위기는 무척 신비롭고 새롭더라고요.마치 남아메리카의 석상을 보고 있는 기분이 들기도 했어요.
제주,제주 돌문화 공원,"장애인 시설이 완벽합니다.  엘리베이터 , 이동 통로 등 장애인 시설이 완벽합니다.외국 관광객들과 가족 단위 관광객이 많았습니다. 생각보다 멋진 조형물들이 많아서 충분한 시간을 가지고 관람하세요.주변에 음식점이나 쉴 곳이 없습니다. 미리 식사하고 방문하세요. "
제주,제주 돌문화 공원,교래리 휴양림 교래자연휴양림내에 위치한 돌문화공원 넓은휴양림내에서 위치해 있어서 숲속을 걸으며 산책하기 좋은장소이다
제주,제주 돌문화 공원,"제주에 사연 많은 돌들에 대한 애기들을 볼수 있는곳 하루방만이 돌로 된것이 아니고, 제주의 화선석으로 된 돌들의 역사와 쓰임새를 잘 보여주는 곳으로 산책하면서 둘러보기가 좋은 장소.고인돌부터시작하여 조선시대에 이르기까지 돌로 만든 생활도구와 그에 대한 쓰임새를 잘 설명하고 있는 곳~"
제주,제주 돌문화 공원,사진 촬영에 적격 날씨만 도와준다면 최고의 사진들을 찍을 수 있음. 매우 넓어서 다 돌아보기가 힘들다면 짧은 코스를 지정해서 돌 수도 있으니 안내판을 잘 보자.
제주,제주 돌문화 공원,우연히 방문한곳 우연히 지나가다 방문한 곳이었는데 박물관구경과 바깥에 돌을 구경하기 좋습니다.일부러 찾아갈 정도는 아닌곳 같습니다.
제주,제주 돌문화 공원,이곳은 산책하며 편하게 둘러보기에 좋아요 박물관이라기 보다는 그냥 문화공원 정도. 편하게 둘러보기에 아주좋아요. 특히 비오는 날 풍경이 멋집니다.
제주,제주 돌문화 공원,구성이 잘되있습니다. 인위적으로 사람들이 만들어놓은것으로 너무너무 위대한 조각상으로 한번 가보시기를 권합니다. 위치는 썩 찾기가 쉽지않습니다.
제주,제주 돌문화 공원,"엄청난 스케일 무엇을 상상하든 그 이상을 볼 수 있는 곳이다. 엄청난 규모에 잘 가꾸어진 환경, 그렇지만 의도한 바가 무엇인지는 정확하게 알 수 없다. 그러나 그 스케일 하나만으로도 압도되는 곳은 분명하다. 워낙 넓기 때문에 시간을 가지고 찾아가야 하는 곳이다."
제주,제주 돌문화 공원,돌문화공원 조용히 산책하면서 힐링하기 좋은 곳입니다. 유명한 관광지보다는 여유를 즐기시기에 좋은 장소입니다.
제주,제주 돌문화 공원,으스스하지만 정말 좋았음 겨울에 가서 으스스했지만..시티버스 타고 돌문화 공원에 갔었습니다.정말 잘 해놓았지만 겨울보단 봄 여름가을이 좋을 것 같아요지금가면 선선하고 좋을 듯 합니다.제주도의 기원과 볼거리 들이 잇습니다.테마가 있는 곳이에요
제주,제주 돌문화 공원,제주의 특색있는 다양한 돌을 감상할 수 있는 이쁜 공원 제주의 특색있는 다양한 돌을 감상할 수 있는 구성이 잘 된 공원. 제주 화산에 대한 깊은 이해를 할 수 있도록 도움이 된곳
