region,attraction,article
제주,관덕정,"Intéressant même si pas beaucoup d'explications en anglais Une plongée dans l'histoire de Jeju.Pas beaucoup d'explications en anglais, mais ça peut quand même se faire. Les bâtiments ont jolis et le jardin agréable.Des jeunes filles viennent s'y faire prendre en photo en hanbok, le vêtement traditionnel coréen.."
제주,관덕정,Not much This pavilion is something to visit when you get dropped off in town by the bus from the cruise ship.  It takes a few minutes to walk around and take a few pics but I certainly wouldn't consider it a must see destination to go to.
제주,관덕정,雨宿りにちょうど良かったです 有料施設の横にある、立派な建物です。この施設は無料でした。私が訪問した時は天気が悪く、隣のコンビニでコーヒーを買って雨宿りをさせてもらいました。
제주,관덕정,Why not If you do not know what to do you can go to visit. Not so much to do in city.But not very interesting and still under construction or repair.
제주,관덕정,"Litlle gem in the middle of a bustling area The area is littered with shops and restaurants and an underground shopping mall.Discovering this gem was truly a delight. Area is a bit small but admission fee is only 1,500₩ for adults."
제주,관덕정,"Just a pavilion This pavilion is next to Jeju Mokgwana. It is just a pavilion, with its typical architecture. There wasn't anyone around. Took some photos and move on. Not worth to specially come here unless you are nearby."
제주,관덕정,"Bangunan khas Korea Tempat ini sangat menarik untuk dikunjungi. di tempat ini banyak terdapat bangunan pavilion khas Korea. Sangat bagus sekali kalau foto di sini. Untuk bisa masuk ke sini, kita bisa membeli tiket masuk di pintu depan. Harga tiketnya tidak terlalu mahal."
제주,관덕정,王朝時代の役所跡 王朝時代の役所跡が修復されてできた施設です。内部には小さいながらも歴史を紹介する博物館がありました。ただし、解説文はほとんどがハングルのみなので、ハングルが読めない我々は内容がよくわかりませんでした。一つだけよく分かったのが、当時の役人の衣装を身に着けて写真撮影ができるコーナーで、帽子から靴まですべてがそろっていました。コスプレ好きの人には良いかも？
제주,관덕정,"Bangunan Tua di Tengah Kota Bangunan yang telah ada sejak abad ke-13 ini, menurut informasi untuk pelancong, adalah bangunan untuk latihan dan pendidikan prajurit, tidak hanya latihan fisik tetapi juga latihan pikiran (""gwandeok"" artinya latihan pikiran dan kebajikan). Keseluruhan kompleks ini lumayan luas dengan keterangan (ada keterangan dalam bahasa Inggris) yang relatif jelas. Biaya masuk terhitung murah, yaitu 2000 won."
제주,구엄리돌염전,멋진장소! 아름다운 옛날 돌 염전. 근처에 왔다면 꼭 보고 가세요. 생각보다 실제로 보면 더 멋져요. 인생샷 사진찍기도 넘넘 좋은곳이에요.
제주,구엄리돌염전,"애월해안도로 필수 관광코스 제주공항에서 렌터카로 애월 해안도로를 따라 25분 정도 달리면 나오는 구엄마을에는 '소금빌레'라 불리는 돌염전이 있습니다.'빌레'는 넓게 펼쳐진 너럭바위를 뜻하는 제주어로, 소금빌레는 그 이름 뜻 그대로 바닷물을 끌어와 햇볕에 말려 소금을 생산하던 넓고 평평한 천연 암반지대를 가리킵니다.맛과 품질이 뛰어나 나라님에게 진상될 정도였다는 소금맛이 무척 궁금했지만 돌소금 만들기 체험 시즌이 아니라서 아쉽게 패스~참고로 구엄어촌체험마을 돌소금 만들기 체험은 1월에서 9월까지 1인 15,000원"
제주,불사리 탑사,오묘한 분위기를 자아내는 곳 오묘한 분위기를 자아내는 곳으로 지나가다 한번쯤 보시면 독특한 기분을 느낄 수 있습니다. 일부러 들른 것은 아닌데 지나가다가 본 광경에 놀랐습니다.
제주,불사리 탑사,"숨은 명소 관광명소로 소문나진않아서 유명하진않지만, 아는사람들은 또 들리고싶다는 불사리탑사 멋졌습니다"
제주,불사리 탑사,볼만 합니다. 관광객들에겐 그리 유명하지 않은 장소입니다.함덕 해수욕장 가는길에 우연히 발견해서 가보았습니다.생각보다 건축물이 멋집니다.세계평화를 기원하는 의미로 세워졌다고 하니 의미도 좋습니다.이곳에서 보는 바다 경치도 좋네요.
제주,불사리 탑사,제주 가볼만한 곳 ! 관광지로 유명하진 않지만 전 사진보고 한번 방문해봤어요~평소 여행지에서 사찰같은곳을 다니는걸 좋아하거든요~~~ 요 사찰은 조국통일과 세계평화를 염원하면 세운 사찰이라고 해요!! 그래서 그런지 뭔가 동양적이지만은 않고... 심플한 디쟌이 아름다웠어요!!글구 경건해지는 느낌..!
제주,불사리 탑사,함덕해수욕장 가는 길에 보이는 돔 함덕해수욕장 가면서 한라산 방향으로 고개를 돌리면 나오는 돔탑인데 그 이름이 불사리 탑사라는 건 트립어드바이저에 와서 알았네요. 멀리 바다가 보이는 전망이 훌륭했던 공간으로 기억합니다.
제주,불사리 탑사,"제주속 숨은 명소.. 제주도의 숨은 명소임.처음 도착하자마자 그 웅장함에 놀라고, 한바퀴 둘러볼만함.자칫 지나칠수 있는곳이지만, 꼭 추천할만한 멋진곳임."
제주,검멀레,검멀레 우도에 있는 해변 중 하나이고 약간 절벽?느낌이라 계단으로 내려가야 해변이 나옵니다 모래는 화산지형 영향으로 검은색입니다 독특하고 예쁜 풍경인데군데군데 쓰레기가 많아 안타깝네요
제주,검멀레,"우도의 근사한 해변 지층이 쌓여있는 모습이 보이는, 해안 동굴도 있는, 독특한 지형의 장소입니다. 바다도 보고, 오름도 보고, 배 타고 둘러볼 수도 있고, 근처에 카페들도 많아서 가볼만 합니다."
제주,검멀레,우도에서 꼭 가봐야 할 명소 우도 선착장에서 차로 10분정도면 도착할 수 있는 곳에 있습니다.이곳은 현무암 때문에 모래도 검은색이고 돌도 검은색 돌이 많습니다. 그래서 뭔가 조금은 어두워보이지만 그래도 이곳에서만 감상할 수 있는 멋진 풍경이 반겨줄 것 입니다.해안선을 따라 멋진 산책로도 잘 정비되어 있고 주변에 많은 상점도 있어서 간식거리 먹으면서 여유롭게 구경하기 좋습니다.
제주,너븐숭이4.3기념관,제주의 아픔을 기억해야 하는 곳 너븐숭이 4.3기념관은 제주의 아픔을 기억해야 하는 곳으로 꼭 방문하길 추천드립니다.북촌리에서 일어난 학살사건으로 기념비가 있는 곳이면서 학살사건에 대해 무지했던 저에겐 큰 충격을 안겨줬고 많은 애도를 표하고 싶은 곳이였습니다.
제주,너븐숭이4.3기념관,제주4.3사태의 아픔을 간직한 곳 1949년 1월 17일에 일어났던 북촌리 집단학살 사건의 진상과 4.3사건과 관련한 자료들이 전시되어 있는 곳이다. 규모는 크지 않지만 아픔은 컸다.이념이라는 말로 사람이 사람을 이렇게 학살할 수 있을까를 다시 생각해 보게 되는 가슴아픈 장소이다. 4.3평화공원도 잘 되어 있지만 이곳도 도로변에 있어서 방문하기 쉬운 곳이니 제주에 방문한다면 한번쯤 가보기를 권한다.
제주,탑동광장,夜は賑やか 近くのホテルに3泊したので、毎日通りました。刺身通り近くの、堤防沿いの広場です。朝は散歩する人がいる程度、昼間は誰もいません。夜になると人が集まってきて、スポーツをしているのが見えました。
제주,탑동광장,"Sea view Nothing much here. The place that local playing skateboard, long board, basketball on the street. If you are a seafood lover, this is the right place to find. "
제주,탑동광장,Nice windy waterfront Our hotel room overlooks this sea. Don’t think there is a way to get down but the waterfront makes for a nice breezy walk. I suppose the reason for the decoration on the barrier is to make the walk interesting and photo worthy. 
제주,탑동광장,"Beautifu Sunset! At the entrance of the plaza, there is tourist information center, where you can get any info related to the area. From this plaza, there are occasional festival from time to time, this time, I just went to see sunset on the ocean. Above the big waves, sunset was pretty. There is long sea-side walk, which leads to Dragon head rock."
제주,아침미소목장,평화롭고 힐링 유일한 단점인 가는 길. 고불고불 하고 돌길이라 타이어 펑크날까 조심조심 가야해요ㅠㅠ 목장에서 파는 우유 요구르트 너무너무 맛있어요.. 아이스크림도 짱이고 체험도 진짜 재미있었어요 기억에 오래오래 남을듯 !
제주,아침미소목장,"아이와 함께 하기 좋은 제주도 여행 스팟, 아침미소목장(The morning smile farm, Jeju Island) 가족들과 함께 하는 6월말 제주도 여행 중에 오전에 아침미소목장을 방문하였습니다덥지만 날씨가 맑아서 좋았던 거 같아요기본적으로 카페가 있고, 송아지들에게 우유를 줄 수 있는 체험존 그리고들판(?) 느낌의 너른 잔디밭과 목장, 예쁜 사진을 위한 포인트존 등이 있어요우선 송아지에게 우유를 주는 체험 학습존은 매우 좋았어요4살 아이라 조금 겁내기는 했지만 책 속에서만 보던 송아지를 보고직접 우유를 주는 체험은 재밌게 했어요카페에는 송아지에게 주는 우유를 비롯하여 치즈나 요구르트 같은 유제품 그리고커피 등을 판매하고 있습니다젖소들이 뛰어다니는 들판 느낌의 넓은 목장이 있어요 스팟 자체가 넓어서참 시원한 기분이 들어요사진 찍기도 좋았던 거 같아요!~ 군데군데 사진을 찍기 위한 장식물이랑 포인트 공간 등이 있어서 젖소들이 있는 목장과 하늘을 뒷배경으로 사진 찍기도 좋구요교통은 대중교통으로는 가기 어려울 듯 해요 가기를 원하면 렌트를 해야 할 거 같고6월말에 같은데 덥긴 했습니다참고로 오전 11시 전에 방문했는데 그 때는 입구 주차장이 한산했지만 정오가 지나니주차장이 꽉 찬 상태였습니다 공간 자체가 아주 넓은 편은 아니라 이동 포함해서는 반나절 정도, 목장은 한 시간에서 한 시간 반 정도 사진 찍고 체험하고 차 한 잔 마시기에 좋은 스팟 같아요사진찍기를 좋아하시는 분들은 가시면 후회는 없을 듯 합니다~"
제주,서우봉,"정말 좋아요 최고! 함덕 해변은 여러번 와봤지만 서우봉을 방문한 것은 처음인데 정말 좋았어요. 체력이 좋지 않은 편인데, 산책로를 돌아보는 것이 많이 힘들지 않아서 여유롭게 산책할 수 있었어요. 함덕 해변의 바다 색이 예뻐서 넋을 잃고 보게되는 곳이에요. 저는 중간정도 오르고 내려왔지만 시간이 많다면 다음에 한바퀴를 다 돌아보고 싶네요."
제주,감귤체험농장 귤향기,"Fun & wonderful experience not to be missed while in Jeju..... We wanted to visit an orange, (tangerine) farm in Jeju, where the famous Jeju oranges are grown.Through the tourists information centre, we found this farm nearest from the city centre. We had to take a bus.It is a very nice orange farm. Fee is 5,000₩ per pax- with unlimited time, eat as much oranges as you want while in the orchard & get to bring back 1kg of oranges at the end of it.Great deal considering 1 small tray of oranges in the markets are selling for same price or higher.The young lady in charge was very friendly & helpful although she don't speak English ( Google Translate comes in handy everytime ).The shop was very nice too. Products made at the farm using their fresh oranges includes jams, confectionery & oranges as well. The small production factory could be seen from the shop.Free tasting of their orange jam plus few pieces biscuits included. The jam was very good, made of real oranges. "
제주,9.81 파크,"레이스981 승부욕 불타오름 배틀 필수 돈이 아깝지 않은 곳이었음jeju activity 9.81park 생각나는대로 리뷰RACE981 Gravity Racing 중력으로 달린다는게 생소하긴 했는데 기름냄새도 안나고 타본 카트들 중에 제일 재밌었음App에 kart racing 끝나고 나면 비디오가 자동으로 저장되어 신기했음Master license 실패했는데도 재밌었음ARENA Laser survival 태어나 처음해보는 새로운 Leisure 였음LAB 981jeju activities 종류별로 있었음게임기로 말도 타고, 야구도 하고, 축구도 하고, 잘 놀았음 9.81PARK제주 가면 또 가고 싶을 듯"
제주,9.81 파크,"재미있었음. 9.81 park  우선 나는 3회 탈수 있는 패키지 쿠폰을 끊었다. 무동력으로 가는것이라 속도가 빠를거지 않을거라 했지만 체감 속도는 갠찮았다. 내려갈때는 금방내려가고 올라올때는 자동으로 올라온다. 내려갈때는 핸드폰을 사용할수 없지만, 올라올때는 사진을 찍을수 있다. 친구들과 내기를 해도 재미있을것 같다. 어플을 설치하고 나면 나중에는 동영상을 다운받을수도 있다. 그외에도  안에 커피숍도 있고, 다른 여러가지 게임도 할수있는 장소가 마련되어있다. 기회가 된다면 한번더 가고싶다."
제주,9.81 파크,"3번 탑승이면 적당 3번 탑승 예약해서 타는데, 한 번 타기는 아쉽고 세 번 정도 탑승하면 적당합니다. 앱 설치하면 동영상도 무료 다운 받을 수 있습니다. 다만 한 번 주행은 1분 남짓인데, 줄서는 시간이 많아서 3번 타면 2시간 가까이 걸리네요. 오래된 네비에는 검색이 안 될 수도 있음."
제주,9.81 파크,레이스 981 애월읍 한라산 중턱에 위치한  자동차 레이싱 파크. 1인승 과 2인승 전기차.800m 정도의 내리막길을 달리는 코스.오래전부터 초등생 딸아이의 기다림으로시작된 레이싱. 난폭운전은 없어서 안전했지만 스릴은 없었다.
제주,관음사탐방로,"The more difficult yet more rewarding trail to Hallasan peak As I've mentioned on my review to Seongpanak Trail, I'd recommend it as the point of entry then exit through Gwaneumsa Trail. But, if you prefer a more challenging option, do the other way around. I went down from the summit through the Gwaneumsa Trail. It was the first week of April and the snow hasn't melted completely yet, making it slippery. It is very much recommended to have a walking stick, in my case, I used my tripod. The scenery in this trail was awesome. There are valleys in yellow and white. You can also find a spring water along the way. Hiking Hallasan in general solo is not a problem, regardless of which trail you take, because there are a lot of other hikers you meet along the way."
제주,용연구름다리,꼭 밤에 가세요 용두암을 둘러보고 쭉 하던 중 용연 구름다리를 발견했습니다 밤에 갔었는데요 정말 조명이 끝내줬어요 무지개빛 조명에 벌레들이 우는  청명한 소리에 너무너무 기분 좋은 밤길 산책이었습니다
제주,왕따나무,"A lonely tree The lonely tree is a amazing place for taking photos, due it's location in a vast landscape is a good place to take photos and explore the beatitude of Jeju."
제주,민오름 -  오라동,"아이와 함께 오르기에도 좋은 오름 해발 252m의 오르기 수월한 오름. 주차 장소가 애매모호 하기는 하지만, 경사가 원만하고 정상에서 보는 경치도 좋음. 정상에 운동기구가 설치되어 있어 동네 주민들도 많이 보임"
제주,선운정사,꼭 밤에 가세요. 낮은 최악. 낮에는 사진을 찍을 가치도 없는 곳입니다. 밤에 조명이 화려하다하여 밤에 가려고 했으나 일정 상 낮에 갈수 밖에 없었는데 가는 길 차로도 험난하고 절의 대부분이 최근에 지어진것으로 낮에 보면 현대미가 가득합니다. 가보니 새로 절 건물도 짓고 있던데 이건 절이 아니고 관광객을 끌어들이기 위한 곳으로 보이네요.
제주,선운정사,야경이 멋있는 선운정사 ! 기대안하고 가서 더 멋있는 선운정사 낮에는 별로일듯 하지만밤엔는 야경이 정말 멋있습니다.사진찍기도 좋고만족합니다.등불과 사진 찍기에 정말 좋습니다.
제주,선운정사,크게 기대안하시는게 좋을듯 블로그 리뷰등을 보며 방문 하였지만.. 특별한게 뭔지 어색한곳야간에 조명으로 괜찮을듯 하지만..야간에 구불구불한 길에 접근하기는 특히 자기차가 아닌 렌트카로는 쉽지 않을듯..확장으로 인해 경내 곳곳이 공사중임왜 유명한지 알수없음
제주,선운정사,어색한듯 아름다운 야경 화려한 야경을 기대한다면 조금은 실망할지도 모른다..주차장도  따로 마련 되어있지만 구불구불 들어가는 입구가 첫방문이기엔 긴장할지도...세련된 ...다소 현대적이라할수있는 사찰에 곱게 색등을 켜 놓았다...등도 예쁘고 절도 예쁘다
제주,선운정사,야경이 아름다운 선운정사 자그마한 절 앞 뒤 마당에 꾸며진 조명꽃들과 연등들로제주도 밤시간 일정을 짜기 좋은 곳빛마루축제가 열리고 있으니동절기는 밤10시까지 무료로 개방되어 있으니 한번 방문해보길 추천찾아갈때 길이 다소 좁은 편이니 운전할때 조심해야함
제주,녹산로유채꽃길,"철 잘 맞춰서 가야되는 곳 불행하게도 제철에 간 게 아니라서 그냥 들판? 허탕만 치고 온 느낌이었습니다. 검색하다가 사진보고 간 곳인데, 2월에는 영 실망이었습니다."
제주,녹산로유채꽃길,드라이브만으로도 기분 좋아지는 곳 길 양옆으로 유채꽃이 피어있어 제철에 가면 드라이브할 때 기분이 좋습니다. 중간중간 차를 세우고 사진을 찍을 만한 포토 스팟들도 있습니다.
제주,아랑조을거리,"A street of interesting food to experience....... As the name implies, this street is a street of restaurants & dining. There are so many ""nice"" appetizing looking  restaurants as we explored the place.A very helpful ""road map"" at the main road entrance shows the restaurants names & types of food & exactly its location within the street.This street is nearby Seogwipo Maeil Olle Market. Seogwipo main town is quite small, so most of these ""attractions"" are quite close by."
제주,혼인지,"조용히 걷기 좋은 유적지 전설이 얽힌 섬, 신이 많은 섬 제주도의 전설 유적지 중 하나입니다. 삼성혈에서 나온 삼신과 벽랑국의 세 공주가 혼례를 올린 800여평의 연못인 혼인지는 지금은 이제 막 꽃이 피기 시작했는데, 5월 이후에는 땀을 식히면서 걷기에 딱 좋은 예쁜 연못길이 될 듯합니다. 올레길이기도 하고 한적해서 더 좋은 곳이었답니다. 굳이 가기엔 애매하지만 전설을 잘 설명해놓은 관람지라 지나가는 길에 들리기엔 좋을 듯합니다."
제주,혼인지,"입장료 무료라서 과거에는 입장료를 받았으나 무료로 바뀌면서 관리가 조금 소홀한 듯합니다.혼인지 제주도의 결혼관습에 얽힌 전설이 있는 곳이나 모르고 보면그냥 공원, 산책로 일뿐인곳...좀 아쉽고, 일부로 찾아가기에는 그러나 제주도에 대해 알고 싶고,여행일정이 넉넉하시다면 가보시는 것도 괜찮겠지요?"
제주,혼인지,지루하고 관리도 안 돼 있어요. 여긴 사실 정원인데 몇 년 전부터 황폐해진 듯해요. 저희는 론리플래닛에서 보고 여기에 대해 알게 됐고요.수목은 지나치게 자라있고 우물은 탁해요. 저희는 5분쯤 둘러보고 화장실 사용하고는 떠났어요.사진을 별로 올리지 못해 아쉽지만 정말 사진을 찍을만하거나 볼만한 게 전혀 없어요.
제주,산지등대,小規模な灯台ですが景色は良いです サラボン公園からターミナル側に下ると、灯台があります。小規模な灯台ですが、旅客ターミナルと海が見渡せて景色が良かったです。灯台から徒歩５分の停留所からシティツアーのバスがでていますので、市内中心部に戻ることができます。
제주,모충사,"Mochungsa Shrine in Sarabong Park There are 3 memorial towers, one of Kim Man Duk, civil uprising volunteers, and one of patriot at the end of Joseon dynasty. There is Kim Man Duk's grave stone, original one which moved here because of road construction in its original place. This is located in Sara-bong(hill) park. It is very low hi,, but you can enjoy beautiful sunrise on the top of hill. Even day time, I could enjoy nice view toward Jeju international port. I recommend walk around the hill first then visit Mochungsa afterwards, The Sarabong walk path is part of Olle #18. There are many locals who work out here. You can feel like a local!"
제주,탑동광장,"Best place for sunset for lazy ones like me Was wanting to catch sunset in Jeju, and it seems all will require some climbing. My family was tired, and hence chose this place instead.Not too bad for being lazy to climb. You will need to go to the far end near the hotel. The road alongside was quiet and very light traffic, so you can park there temporarily to view the sunset."
제주,견월악 목마장,저 멀리 말이 보이는 멋진곳 추석때 방문했습니다 절물 휴양림을 갔다가 비가 와서 포기하다가 가는길에 들렸던것입니다안개가 자욱하니 멋졌어요 주차장도 넓고 조용하게 말을 보면서 20-30분 정도 구경하기 좋아요
제주,종종제주,맘에 드는 소품 보는 재미가 있었어요.^^ 제주 작은 시골 마을에 자리잡고 있는데 건물 인테리어도 이쁘고 내부도 깔끔하고 귀여운 소품도 많고 즐거운 추억 만들다가요.^^
대전,스카이로드,"성심당 가는 길 지하상가 쇼핑, 성심당 주변 맛집, NC백화점 방문, 근현대전시관 관람, 대전 역전 시장 관광, 스카이 로드 , 주변 미술관과 소제동 걷기 , 하루만에 모두 할 수 있는것들 여러분도 도전!"
대전,스카이로드,"대전의 번화가 으능정이 문화의거리 '스카이로드' 대전의 번화가인 으능정이 문화의거리에 설치된 대형 LED아케이드입니다. 주변에 음식점, 화장품숍, 옷가게 등 많은 상점들이 있어서 쇼핑도 하고 대전의 밤 문화를 즐기기 좋은 곳이었습니다.  가까이에 대전역, 도시철도 중앙로역, 중앙로지하상가, 중앙시장, 성심당 등도 있어 교통도 편리했고, 이것저것 다양한 쇼핑도 할 수 있어서 좋았습니다. 예전보다는 한적한 느낌이었는데  주변 상점 안에는 많은 사람들이 있었습니다."
대전,스카이로드,먹거리와 쇼핑할것이 많은 곳 대전 은행동의 중심 스카이로드로 가서 각종 길거리 음식과 의류 및 잡화를 저렴하게 구매할 수 있어서 좋았습니다. 사람들도 바글바글~ 다음번엔 해가 지고 가 어두운곳에서 스크린이 밝게 비치는 모습을 보고 싶네요.
대전,스카이로드,스카이로드 스카이로드는 아이들이 시내라고 부르는 은행동에 위치하고 있습니다. 예~전에는 없었는데 어느 순간 생겼더라고요.밤에도 밝아서 좋아요^^
대전,스카이로드,비올때만 좋은 스카이로드 화질이 엄청 다이나믹하지도 않고영상을 틀어주는 시간이 너무 짧아서비가림막 정도..길가는 사람 모습을 보여주는 것이 색다른 체험일수도 있음
대전,스카이로드,은행동의 상징 대형 LED 아케이드 다른 지역에서는 보기 힘든 대형 LED 아케이드이다. 웅장하고 밝다. 천장 LED를 통해 축구 경기를 틀어주기도 하는데 누워서 보는 사람들도 있고 꽤 재미있다.
대전,스카이로드,신기했어요 스카이로드 너무 신기했습니다. 중심가라해서 들렸다가 신선함 느끼고가네요. 사람들도 많고 젊음의 거리 같았어요 놀거리 쇼핑할거리가 많더라구요~~이영자가 다녀왔던 성심당도 있어서 바로 갔네요 ㅋㅋ 
대전,스카이로드,처음 보면 신기함 처음 은행동 왔을 때 와... 하고 되게 신기해했던 곳. 제가 갔을 땐 문자로 사진이나 메세지 보내니까 화면에 뜨던데 그것도 엄청 신기했어요. 그리고 비오면 비 안 맞을 것 같아서 편해 보이기도? (실제로 경험해보진 않음)
대전,스카이로드,스카이로드 스카이로드는 은행동의 중심이라고 할 수 있다고 생각합니다.이 길의 양 옆으로 화장품 가게와 옷가게 등 굉장히 많은 가게들이 있습니다.
대전,스카이로드,대전 은행동의 랜드마크 은행동에서 쇼핑을 즐겁게하기위해 민든 시설로 하늘을 LED 천장으로 덮었다.한번 보고나서는 싫증이 나지만 대전 방문객에서는 또하나의 볼거리를 제공한다.카메라가있어 자신의 모습이 천장에 투영되기도한다.기념사진 찰칵!
